{
  "schemaVersion": 1,
  "graph": "vendors/example",
  "commit": "0e6f5ed",
  "run": {
    "id": 1,
    "url": "https://github.com/practice-library/graphs/actions/runs/1",
    "startedAt": "2026-10-31T12:00:00Z",
    "finishedAt": "2026-10-31T12:03:00Z"
  },
  "results": [
    {
      "node": "price.example.widget-input",
      "source": "https://docs.example.com/pricing",
      "finalUrl": "https://docs.example.com/pricing",
      "httpStatus": 200,
      "fetchedAt": "2026-10-31T12:01:00Z",
      "sha256": "aaaaaaaaaaaaaaaaaaaaaaaaaaaaaaaaaaaaaaaaaaaaaaaaaaaaaaaaaaaaaaaa",
      "outcome": "unchanged"
    },
    {
      "node": "rate-limit.example.widget-rpm-free",
      "source": "https://docs.example.com/limits",
      "finalUrl": "https://docs.example.com/limits",
      "httpStatus": 200,
      "fetchedAt": "2026-10-31T12:01:05Z",
      "sha256": "bbbbbbbbbbbbbbbbbbbbbbbbbbbbbbbbbbbbbbbbbbbbbbbbbbbbbbbbbbbbbbbb",
      "outcome": "changed",
      "reason": "the quote is not on the page"
    },
    {
      "node": "plan.example.free",
      "source": "https://docs.example.com/plans",
      "httpStatus": 503,
      "fetchedAt": "2026-10-31T12:01:10Z",
      "outcome": "unreadable",
      "reason": "HTTP 503"
    }
  ]
}
